ind,key,docs,classification,class,category_map,real_cat,label,scores,real_final,pred_final
480,URLConnection_getDoInput,"get do input .the abstract class url connection is the superclass of all classes that represent a communications link between the application and a url  instances of this class can be used both to read from and to write to the resource referenced by the url  in general, creating a connection to a url is a multistep process",source,URLConnection,no category,network connection,network connection,0.14261791110038757,network,network
492,AudioTrack_setNotificationMarkerPosition,"set notification marker position .the audio track class manages and plays a single audio resource for java applications  it allows streaming of pcm audio buffers to the audio sink for playback  this is achieved by ""pushing"" the data to the audio track object using one of the  write, write,  and write methods",sink,AudioTrack,audio,audio,audio information,0.5023864507675171,audio,audio
496,DatagramSocket_getLocalSocketAddress,get local socket address .this class represents a socket for sending and receiving datagram packets,source,DatagramSocket,no category,network connection,network information,0.3383539915084839,network,network
499,Calendar_toString,"to string . icu's replacement for calendar  methods, fields, and other functionality specific to icu are labeled '[icu]'",source,Calendar,calendar information,calendar information,calendar information,0.47644731402397156,calendar,calendar
513,HttpURLConnection_getErrorStream,get error stream .a url connection with support for http specific features  see  the spec  for details,source,HttpURLConnection,no category,network connection,network information,0.36696651577949524,network,network
514,Calendar_getTimeZone,"get time zone . icu's replacement for calendar  methods, fields, and other functionality specific to icu are labeled '[icu]'",source,Calendar,calendar information,calendar information,calendar information,0.33640843629837036,calendar,calendar
515,AudioTrack_setPlaybackHeadPosition,"set playback head position .the audio track class manages and plays a single audio resource for java applications  it allows streaming of pcm audio buffers to the audio sink for playback  this is achieved by ""pushing"" the data to the audio track object using one of the  write, write,  and write methods",sink,AudioTrack,audio,audio,audio information,0.5790318846702576,audio,audio
516,Calendar_get,"get . icu's replacement for calendar  methods, fields, and other functionality specific to icu are labeled '[icu]'",source,Calendar,calendar information,calendar information,calendar information,0.4802010953426361,calendar,calendar
517,SQLiteProgram_bindBlob,bind blob .a base class for compiled s q lite programs,sink,SQLiteProgram,no category,database,media,0.185784712433815,database,media
519,DropBoxManager_addFile,"add file .enqueues chunks of data    the queue is size bounded and will drop old data if the enqueued data exceeds the maximum size   you can think of this as a persistent, system wide, blob oriented ""logcat""",sink,DropBoxManager,files,files,logging,0.4033389389514923,files,log
526,DatagramSocket_getInetAddress,get inet address .this class represents a socket for sending and receiving datagram packets,source,DatagramSocket,no category,network connection,network information,0.4070464074611664,network,network
529,AccountManager_getAccountsByType,"get accounts by type .this class provides access to a centralized registry of the user's online accounts   the user enters credentials  once per account, granting applications access to online resources with ""one click"" approval",source,AccountManager,user account,user account,user information,0.48154667019844055,user account,user account
531,HttpURLConnection_getPermission,get permission .a url connection with support for http specific features  see  the spec  for details,source,HttpURLConnection,no category,network connection,network information,0.3249519169330597,network,network
533,URLConnection_getReadTimeout,"get read timeout .the abstract class url connection is the superclass of all classes that represent a communications link between the application and a url  instances of this class can be used both to read from and to write to the resource referenced by the url  in general, creating a connection to a url is a multistep process",source,URLConnection,no category,network connection,network connection,0.14541840553283691,network,network
541,WifiP2pManager_requestGroupInfo,"request group info .this class provides the api for managing wifi peer to peer connectivity  this lets an application discover available peers, setup connection to peers and query for the list of peers  when a p2p connection is formed over wifi, the device continues to maintain the uplink connection over mobile or any other available network for internet connectivity on the device",sink,WifiP2pManager,network connection,network connection,network connection,0.4926362633705139,network,network
542,URLConnection_getIfModifiedSince,"get if modified since .the abstract class url connection is the superclass of all classes that represent a communications link between the application and a url  instances of this class can be used both to read from and to write to the resource referenced by the url  in general, creating a connection to a url is a multistep process",source,URLConnection,no category,network connection,media,0.13837328553199768,network,media
544,ServerSocket_getInetAddress,"get inet address .this class implements server sockets  a server socket waits for requests to come in over the network  it performs some operation based on that request, and then possibly returns a result to the requester",source,ServerSocket,no category,network connection,network information,0.40982189774513245,network,network
547,AudioManager_getParameters,get parameters .audio manager provides access to volume and ringer mode control,source,AudioManager,no category,audio,audio information,0.5495880842208862,audio,audio
550,MifareUltralight_getType,get type .provides access to mifare ultralight properties and input or output operations on a tag,source,MifareUltralight,nfc information,nfc communication,nfc information,0.09790962189435959,nfc,nfc
551,URLConnection_getOutputStream,"get output stream .the abstract class url connection is the superclass of all classes that represent a communications link between the application and a url  instances of this class can be used both to read from and to write to the resource referenced by the url  in general, creating a connection to a url is a multistep process",source,URLConnection,no category,network connection,network connection,0.13417747616767883,network,network
554,SQLiteProgram_bindDouble,bind double .a base class for compiled s q lite programs,sink,SQLiteProgram,no category,database,media,0.18089047074317932,database,media
555,BassBoost_setStrength,set strength .bass boost is an audio effect to boost or amplify low frequencies of the sound  it is comparable to a simple equalizer but limited to one band amplification in the low frequency range,sink,BassBoost,audio,audio,audio information,0.7177069187164307,audio,audio
560,SSLEngine_unwrap,"unwrap .a class which enables secure communications using protocols such as the secure sockets layer  or  ietf rfc 2246 "" transport layer security""   protocols, but is transport independent",source,SSLEngine,network information,network information,media,0.17298032343387604,network,media
561,NsdManager_discoverServices,"discover services .the network service discovery manager class provides the api to discover services on a network  as an example, if device a and device b are connected over a wifi network, a game registered on device a can be discovered by a game on device b  another example use case is an application discovering printers on the network",sink,NsdManager,network connection,network connection,network information,0.2660568654537201,network,network
562,WifiP2pManager_addServiceRequest,"add service request .this class provides the api for managing wifi peer to peer connectivity  this lets an application discover available peers, setup connection to peers and query for the list of peers  when a p2p connection is formed over wifi, the device continues to maintain the uplink connection over mobile or any other available network for internet connectivity on the device",sink,WifiP2pManager,network connection,network connection,network connection,0.4199349284172058,network,network
563,AccountManager_getAuthTokenByFeatures,"get auth token by features .this class provides access to a centralized registry of the user's online accounts   the user enters credentials  once per account, granting applications access to online resources with ""one click"" approval",source,AccountManager,user account,user account,user information,0.3847828507423401,user account,user account
566,SQLiteCursor_getCount,get count .a cursor implementation that exposes results from a query on a s q lite database  s q lite cursor is not internally synchronized so code using a s q lite cursor from multiple threads should perform its own synchronization when using the s q lite cursor,source,SQLiteCursor,database,database,database information,0.5590924024581909,database,database
571,Calendar_getDisplayNames,"get display names .the calendar class is an abstract class that provides methods for converting between a specific instant in time and a set of calendar fields such as y e a r, m o n t h, d a y_ o f_ m o n t h, h o u r, and so on, and for manipulating the calendar fields, such as getting the date of the next week  an instant in time can be represented by a millisecond value that is an offset from the epoch, january 1, 1970 00:00:00 000 gmt ",source,Calendar,calendar information,calendar information,calendar information,0.7677127718925476,calendar,calendar
572,URLConnection_getContent,"get content .the abstract class url connection is the superclass of all classes that represent a communications link between the application and a url  instances of this class can be used both to read from and to write to the resource referenced by the url  in general, creating a connection to a url is a multistep process",source,URLConnection,no category,network connection,network connection,0.12707214057445526,network,network
575,NfcA_getTag,get tag .provides access to nfc a  properties and input or output operations on a tag,source,NfcA,nfc information,nfc information,nfc information,0.4248414635658264,nfc,nfc
577,SSLEngine_getSSLParameters,"get ssl parameters .a class which enables secure communications using protocols such as the secure sockets layer  or  ietf rfc 2246 "" transport layer security""   protocols, but is transport independent",source,SSLEngine,network information,network information,network information,0.16085048019886017,network,network
587,AccountManager_setUserData,"set user data .this class provides access to a centralized registry of the user's online accounts   the user enters credentials  once per account, granting applications access to online resources with ""one click"" approval",sink,AccountManager,user account,user account,user information,0.5133972764015198,user account,user account
591,URLConnection_getURL,"get url .the abstract class url connection is the superclass of all classes that represent a communications link between the application and a url  instances of this class can be used both to read from and to write to the resource referenced by the url  in general, creating a connection to a url is a multistep process",source,URLConnection,no category,network connection,media,0.1347091645002365,network,media
592,ClassLoader_getResourceAsStream,"get resource as stream .a class loader is an object that is responsible for loading classes  the class class loader is an abstract class   given the binary name of a class, a class loader should attempt to locate or generate data that constitutes a definition for the class   a typical strategy is to transform the name into a file name and then read a ""class file"" of that name from a file system",source,ClassLoader,network information,system settings,file information,0.29890504479408264,system settings,files
599,ServerSocket_getChannel,"get channel .this class implements server sockets  a server socket waits for requests to come in over the network  it performs some operation based on that request, and then possibly returns a result to the requester",source,ServerSocket,no category,network connection,network connection,0.4064398407936096,network,network
601,DatagramSocket_getReceiveBufferSize,get receive buffer size .this class represents a socket for sending and receiving datagram packets,source,DatagramSocket,no category,network connection,network connection,0.33469247817993164,network,network
604,PresetReverb_setProperties,"set properties .a sound generated within a room travels in many directions  the listener first hears the direct sound from the source itself  later, he or she hears discrete echoes caused by sound bouncing off nearby walls, the ceiling and the floor  as sound waves arrive after undergoing more and more reflections, individual reflections become indistinguishable and the listener hears continuous reverberation that decays over time  reverb is vital for modeling a listener's environment  it can be used in music applications to simulate music being played back in various environments, or in games to immerse the listener within the game's environment  the preset reverb class allows an application to configure the global reverb using a reverb preset  this is primarily used for adding some reverb in a music playback context  applications requiring control over a more advanced environmental reverb are advised to use the environmental reverb class",sink,PresetReverb,audio,audio,audio information,0.2776454985141754,audio,audio
605,SQLiteCursor_getColumnIndex,get column index .a cursor implementation that exposes results from a query on a s q lite database  s q lite cursor is not internally synchronized so code using a s q lite cursor from multiple threads should perform its own synchronization when using the s q lite cursor,source,SQLiteCursor,database,database,database information,0.5525451302528381,database,database
608,AudioTrack_getPlayState,"get play state .the audio track class manages and plays a single audio resource for java applications  it allows streaming of pcm audio buffers to the audio sink for playback  this is achieved by ""pushing"" the data to the audio track object using one of the  write, write,  and write methods",source,AudioTrack,no category,audio,audio information,0.6049855351448059,audio,audio
622,AudioTrack_getMaxVolume,"get max volume .the audio track class manages and plays a single audio resource for java applications  it allows streaming of pcm audio buffers to the audio sink for playback  this is achieved by ""pushing"" the data to the audio track object using one of the  write, write,  and write methods",source,AudioTrack,no category,audio,audio information,0.6704096794128418,audio,audio
625,ServerSocket_bind,"bind .this class implements server sockets  a server socket waits for requests to come in over the network  it performs some operation based on that request, and then possibly returns a result to the requester",sink,ServerSocket,no category,network connection,network connection,0.3196026384830475,network,network
630,DatagramSocket_setSendBufferSize,set send buffer size .this class represents a socket for sending and receiving datagram packets,sink,DatagramSocket,no category,network connection,network connection,0.34337061643600464,network,network
631,Debug_dumpHprofData,"dump hprof data .provides various debugging methods for android applications, including tracing and allocation counts",sink,Debug,files,files,media,0.1605904996395111,files,media
634,SSLContext_getClientSessionContext,get client session context .instances of this class represent a secure socket protocol implementation which acts as a factory for secure socket factories or ssl engines  this class is initialized with an optional set of key and trust managers and source of secure random bytes,source,SSLContext,network information,network connection,network information,0.22896228730678558,network,network
641,GregorianCalendar_getMinimum,get minimum .gregorian calendar is a concrete subclass of calendar and provides the standard calendar system used by most of the world,source,GregorianCalendar,calendar information,calendar information,calendar information,0.6446439027786255,calendar,calendar
645,AudioManager_setRingerMode,set ringer mode .audio manager provides access to volume and ringer mode control,sink,AudioManager,audio,audio,audio information,0.5550572276115417,audio,audio
651,URLConnection_getPermission,"get permission .the abstract class url connection is the superclass of all classes that represent a communications link between the application and a url  instances of this class can be used both to read from and to write to the resource referenced by the url  in general, creating a connection to a url is a multistep process",source,URLConnection,no category,network connection,media,0.142784982919693,network,media
652,Calendar_getInstance,"get instance . icu's replacement for calendar  methods, fields, and other functionality specific to icu are labeled '[icu]'",source,Calendar,calendar information,calendar information,calendar information,0.5409137606620789,calendar,calendar
653,AccountManager_updateCredentials,"update credentials .this class provides access to a centralized registry of the user's online accounts   the user enters credentials  once per account, granting applications access to online resources with ""one click"" approval",sink,AccountManager,user account,user account,user information,0.36967897415161133,user account,user account
655,AccountManager_invalidateAuthToken,"invalidate auth token .this class provides access to a centralized registry of the user's online accounts   the user enters credentials  once per account, granting applications access to online resources with ""one click"" approval",sink,AccountManager,user account,user account,user information,0.3088054656982422,user account,user account
658,MifareUltralight_get,get .provides access to mifare ultralight properties and input or output operations on a tag,source,MifareUltralight,nfc information,nfc information,media,0.109066903591156,nfc,media
660,MifareUltralight_readPages,read pages .provides access to mifare ultralight properties and input or output operations on a tag,source,MifareUltralight,nfc information,nfc information,media,0.2641574442386627,nfc,media
664,NfcF_transceive,transceive .provides access to nfc f  properties and input or output operations on a tag,source,NfcF,nfc information,nfc information,nfc information,0.267743319272995,nfc,nfc
665,SQLiteDatabase_update,update .exposes methods to manage a s q lite database,sink,SQLiteDatabase,no category,database,database information,0.4499623775482178,database,database
669,NfcA_get,get .provides access to nfc a  properties and input or output operations on a tag,source,NfcA,nfc information,nfc information,nfc information,0.3491778075695038,nfc,nfc
677,WifiP2pManager_setDnsSdResponseListeners,"set dns sd response listeners .this class provides the api for managing wifi peer to peer connectivity  this lets an application discover available peers, setup connection to peers and query for the list of peers  when a p2p connection is formed over wifi, the device continues to maintain the uplink connection over mobile or any other available network for internet connectivity on the device",sink,WifiP2pManager,network connection,network connection,network connection,0.5000661015510559,network,network
681,HttpURLConnection_setRequestMethod,set request method .a url connection with support for http specific features  see  the spec  for details,sink,HttpURLConnection,no category,network connection,network information,0.31955859065055847,network,network
682,WifiP2pManager_removeLocalService,"remove local service .this class provides the api for managing wifi peer to peer connectivity  this lets an application discover available peers, setup connection to peers and query for the list of peers  when a p2p connection is formed over wifi, the device continues to maintain the uplink connection over mobile or any other available network for internet connectivity on the device",sink,WifiP2pManager,network connection,network connection,network connection,0.4614959955215454,network,network
686,MediaPlayer_setDataSource,set data source .media player class can be used to control playback of audio or video files and streams,sink,MediaPlayer,files,media,media,0.37797826528549194,media,media
687,URL_openConnection,"open connection .class url represents a uniform resource locator, a pointer to a ""resource"" on the world wide web  a resource can be something as simple as a file or a directory, or it can be a reference to a more complicated object, such as a query to a database or to a search engine  more information on the types of urls and their formats can be found at: types of ur",sink,URL,network connection,network connection,file information,0.37143391370773315,network,files
688,NfcA_getTimeout,get timeout .provides access to nfc a  properties and input or output operations on a tag,source,NfcA,nfc information,nfc information,nfc information,0.410050630569458,nfc,nfc
692,SSLContext_getDefaultSSLParameters,get default ssl parameters .instances of this class represent a secure socket protocol implementation which acts as a factory for secure socket factories or ssl engines  this class is initialized with an optional set of key and trust managers and source of secure random bytes,source,SSLContext,network information,network information,media,0.12454463541507721,network,media
696,Debug_dumpService,"dump service .provides various debugging methods for android applications, including tracing and allocation counts",sink,Debug,files,files,media,0.1472325623035431,files,media
697,AudioTrack_getNativeOutputSampleRate,"get native output sample rate .the audio track class manages and plays a single audio resource for java applications  it allows streaming of pcm audio buffers to the audio sink for playback  this is achieved by ""pushing"" the data to the audio track object using one of the  write, write,  and write methods",source,AudioTrack,no category,audio,audio information,0.5297731757164001,audio,audio
699,Calendar_getTimeInMillis,"get time in millis . icu's replacement for calendar  methods, fields, and other functionality specific to icu are labeled '[icu]'",source,Calendar,calendar information,calendar information,calendar information,0.35205331444740295,calendar,calendar
700,AccessibilityManager_sendAccessibilityEvent,"send accessibility event .system level service that serves as an event dispatch for accessibility events, and provides facilities for querying the accessibility state of the system  accessibility events are generated when something notable happens in the user interface, for example an activity starts, the focus or selection of a view changes etc  parties interested in handling accessibility events implement and register an accessibility service which extends accessibility service",sink,AccessibilityManager,log,system settings,media,0.19271844625473022,system settings,media
707,ServerSocket_getReceiveBufferSize,"get receive buffer size .this class implements server sockets  a server socket waits for requests to come in over the network  it performs some operation based on that request, and then possibly returns a result to the requester",source,ServerSocket,no category,network connection,network connection,0.42382052540779114,network,network
710,RandomAccessFile_write,"write .instances of this class support both reading and writing to a random access file  a random access file behaves like a large array of bytes stored in the file system  there is a kind of cursor, or index into the implied array, called the file pointer; input operations read bytes starting at the file pointer and advance the file pointer past the bytes read  if the random access file is created in read or write mode, then output operations are also available; output operations write bytes starting at the file pointer and advance the file pointer past the bytes written  output operations that write past the current end of the implied array cause the array to be extended  the file pointer can be read by the get file pointer method and set by the seek method",sink,RandomAccessFile,files,files,media,0.19244837760925293,files,media
713,GregorianCalendar_getLeastMaximum,get least maximum .gregorian calendar is a concrete subclass of calendar and provides the standard calendar system used by most of the world,source,GregorianCalendar,calendar information,calendar information,calendar information,0.6974501013755798,calendar,calendar
720,ServerSocket_getReuseAddress,"get reuse address .this class implements server sockets  a server socket waits for requests to come in over the network  it performs some operation based on that request, and then possibly returns a result to the requester",source,ServerSocket,no category,network connection,network connection,0.41241568326950073,network,network
722,Calendar_set,"set . icu's replacement for calendar  methods, fields, and other functionality specific to icu are labeled '[icu]'",sink,Calendar,no category,calendar,calendar information,0.4843025505542755,calendar,calendar
724,DatagramSocket_send,send .this class represents a socket for sending and receiving datagram packets,sink,DatagramSocket,no category,network connection,network connection,0.2913929224014282,network,network
