ind,key,docs,classification,class,category_map,real_cat,label,scores,real_final,pred_final
729,ServerSocket_getSoTimeout,"get so timeout .this class implements server sockets  a server socket waits for requests to come in over the network  it performs some operation based on that request, and then possibly returns a result to the requester",source,ServerSocket,no category,network connection,network connection,0.411447674036026,network,network
730,LocationManager_setTestProviderEnabled,"set test provider enabled .this class provides access to the system location services  these services allow applications to obtain periodic updates of the device's geographical location, or to be notified when the device enters the proximity of a given geographical location",sink,LocationManager,geolocation,geolocation,geographical location,0.2502145767211914,geolocation,geolocation
732,SmsManager_sendDataMessage,"send data message .manages sms operations such as sending data, text, and pdu sms messages  get this object by calling the static method get default  to create an instance of sms manager associated with a specific subscription i d, call get sms manager for subscription id  this is typically used for devices that support multiple active subscriptions at once",sink,SmsManager,text message,text message,media information,0.45463091135025024,text message,media
734,IsoDep_get,get .provides access to iso dep  properties and input or output operations on a tag,source,IsoDep,nfc information,nfc information,file information,0.08818016946315765,nfc,files
740,URLConnection_getInputStream,"get input stream .the abstract class url connection is the superclass of all classes that represent a communications link between the application and a url  instances of this class can be used both to read from and to write to the resource referenced by the url  in general, creating a connection to a url is a multistep process",source,URLConnection,no category,network connection,media,0.135999858379364,network,media
741,WallpaperManager_setBitmap,"set bitmap .provides access to the system wallpaper  with wallpaper manager, you can get the current wallpaper, get the desired dimensions for the wallpaper, set the wallpaper, and more",sink,WallpaperManager,log,media,media,0.3094242811203003,media,media
743,Calendar_getFirstDayOfWeek,"get first day of week . icu's replacement for calendar  methods, fields, and other functionality specific to icu are labeled '[icu]'",source,Calendar,calendar information,calendar information,calendar information,0.42103493213653564,calendar,calendar
744,CalendarView_setMinDate,set min date .this class is a calendar widget for displaying and selecting dates  the range of dates supported by this calendar is configurable,sink,CalendarView,no category,calendar information,calendar information,0.9282867312431335,calendar,calendar
745,MifareUltralight_setTimeout,set timeout .provides access to mifare ultralight properties and input or output operations on a tag,sink,MifareUltralight,nfc communication,nfc communication,media,0.11529915779829025,nfc,media
747,SQLiteCursor_getDatabase,get database .a cursor implementation that exposes results from a query on a s q lite database  s q lite cursor is not internally synchronized so code using a s q lite cursor from multiple threads should perform its own synchronization when using the s q lite cursor,source,SQLiteCursor,database,database,database information,0.6787299513816833,database,database
748,DatagramSocket_setSoTimeout,set so timeout .this class represents a socket for sending and receiving datagram packets,sink,DatagramSocket,no category,network connection,network connection,0.32879552245140076,network,network
749,Log_e,e .api for sending log output,sink,Log,log,log,logging,0.4526810944080353,log,log
750,FileOutputStream_write,"write .a file output stream is an output stream for writing data to a file or to a file descriptor  whether or not a file is available or may be created depends upon the underlying platform   some platforms, in particular, allow a file to be opened for writing by only one file output stream  at a time   in such situations the constructors in this class will fail if the file involved is already open",sink,FileOutputStream,files,files,file information,0.40681192278862,files,files
751,TrafficStats_getTotalTxBytes,"get total tx bytes .class that provides network traffic statistics  these statistics include bytes transmitted and received and network packets transmitted and received, over all interfaces, over the mobile interface, and on a per uid basis",source,TrafficStats,network information,network connection,network information,0.6746636033058167,network,network
753,AudioTrack_getSampleRate,"get sample rate .the audio track class manages and plays a single audio resource for java applications  it allows streaming of pcm audio buffers to the audio sink for playback  this is achieved by ""pushing"" the data to the audio track object using one of the  write, write,  and write methods",source,AudioTrack,no category,audio,audio information,0.61700040102005,audio,audio
754,TrafficStats_setThreadStatsTag,"set thread stats tag .class that provides network traffic statistics  these statistics include bytes transmitted and received and network packets transmitted and received, over all interfaces, over the mobile interface, and on a per uid basis",sink,TrafficStats,network connection,network connection,network information,0.5985028147697449,network,network
755,CalendarView_getDate,get date .this class is a calendar widget for displaying and selecting dates  the range of dates supported by this calendar is configurable,source,CalendarView,calendar information,calendar information,calendar information,0.9248723387718201,calendar,calendar
756,WifiP2pManager_setServiceResponseListener,"set service response listener .this class provides the api for managing wifi peer to peer connectivity  this lets an application discover available peers, setup connection to peers and query for the list of peers  when a p2p connection is formed over wifi, the device continues to maintain the uplink connection over mobile or any other available network for internet connectivity on the device",sink,WifiP2pManager,network connection,network connection,network connection,0.47776734828948975,network,network
757,AudioTrack_getStreamType,"get stream type .the audio track class manages and plays a single audio resource for java applications  it allows streaming of pcm audio buffers to the audio sink for playback  this is achieved by ""pushing"" the data to the audio track object using one of the  write, write,  and write methods",source,AudioTrack,no category,audio,audio information,0.5703293681144714,audio,audio
758,MifareUltralight_getTag,get tag .provides access to mifare ultralight properties and input or output operations on a tag,source,MifareUltralight,nfc information,nfc information,media,0.16079193353652954,nfc,media
760,ClassLoader_getSystemResources,"get system resources .a class loader is an object that is responsible for loading classes  the class class loader is an abstract class   given the binary name of a class, a class loader should attempt to locate or generate data that constitutes a definition for the class   a typical strategy is to transform the name into a file name and then read a ""class file"" of that name from a file system",source,ClassLoader,network information,network connection,file information,0.4893852770328522,network,files
768,SSLParameters_getWantClientAuth,"get want client auth .encapsulates parameters for an ssl or  tls connection  the parameters are the list of ciphersuites to be accepted in an ssl or  tls handshake, the list of protocols to be allowed, the endpoint identification algorithm during ssl or  tls handshaking, the server name indication , the algorithm constraints and whether ssl or  tls servers should request or require client authentication, etc",source,SSLParameters,network information,network connection,network connection,0.18906354904174805,network,network
770,AudioTrack_getChannelCount,"get channel count .the audio track class manages and plays a single audio resource for java applications  it allows streaming of pcm audio buffers to the audio sink for playback  this is achieved by ""pushing"" the data to the audio track object using one of the  write, write,  and write methods",source,AudioTrack,no category,audio,audio information,0.6444351077079773,audio,audio
771,NfcF_setTimeout,set timeout .provides access to nfc f  properties and input or output operations on a tag,sink,NfcF,nfc communication,nfc communication,nfc information,0.3681354522705078,nfc,nfc
779,NfcF_getTag,get tag .provides access to nfc f  properties and input or output operations on a tag,source,NfcF,nfc information,nfc information,nfc information,0.43491682410240173,nfc,nfc
781,WifiP2pManager_removeServiceRequest,"remove service request .this class provides the api for managing wifi peer to peer connectivity  this lets an application discover available peers, setup connection to peers and query for the list of peers  when a p2p connection is formed over wifi, the device continues to maintain the uplink connection over mobile or any other available network for internet connectivity on the device",sink,WifiP2pManager,network connection,network connection,network connection,0.501446008682251,network,network
785,IsoDep_getMaxTransceiveLength,get max transceive length .provides access to iso dep  properties and input or output operations on a tag,source,IsoDep,nfc information,nfc information,network connection,0.1049543172121048,nfc,network
790,SSLContext_getSupportedSSLParameters,get supported ssl parameters .instances of this class represent a secure socket protocol implementation which acts as a factory for secure socket factories or ssl engines  this class is initialized with an optional set of key and trust managers and source of secure random bytes,source,SSLContext,network information,network connection,media,0.13321436941623688,network,media
796,MifareUltralight_transceive,transceive .provides access to mifare ultralight properties and input or output operations on a tag,source,MifareUltralight,nfc information,nfc information,nfc communication,0.11942334473133087,nfc,nfc
799,URLConnection_getContentLength,"get content length .the abstract class url connection is the superclass of all classes that represent a communications link between the application and a url  instances of this class can be used both to read from and to write to the resource referenced by the url  in general, creating a connection to a url is a multistep process",source,URLConnection,no category,network connection,media,0.1356213241815567,network,media
800,NfcA_getAtqa,get atqa .provides access to nfc a  properties and input or output operations on a tag,source,NfcA,nfc information,nfc information,nfc information,0.37546586990356445,nfc,nfc
802,LocationManager_sendExtraCommand,"send extra command .this class provides access to the system location services  these services allow applications to obtain periodic updates of the device's geographical location, or to be notified when the device enters the proximity of a given geographical location",sink,LocationManager,geolocation,geolocation,geographical location,0.21731901168823242,geolocation,geolocation
811,AudioManager_getProperty,get property .audio manager provides access to volume and ringer mode control,source,AudioManager,no category,audio,audio information,0.6035442352294922,audio,audio
812,Debug_startMethodTracing,"start method tracing .provides various debugging methods for android applications, including tracing and allocation counts",sink,Debug,files,log,media,0.15572719275951385,log,media
821,Virtualizer_setProperties,"set properties .an audio virtualizer is a general name for an effect to spatialize audio channels  the exact behavior of this effect is dependent on the number of audio input channels and the types and number of audio output channels of the device  for example, in the case of a stereo input and stereo headphone output, a stereo widening effect is used when this effect is turned on",sink,Virtualizer,audio,audio,audio information,0.24890398979187012,audio,audio
829,URLConnection_getLastModified,"get last modified .the abstract class url connection is the superclass of all classes that represent a communications link between the application and a url  instances of this class can be used both to read from and to write to the resource referenced by the url  in general, creating a connection to a url is a multistep process",source,URLConnection,no category,network connection,network connection,0.14528286457061768,network,network
836,AccountManager_editProperties,"edit properties .this class provides access to a centralized registry of the user's online accounts   the user enters credentials  once per account, granting applications access to online resources with ""one click"" approval",source,AccountManager,user account,user account,user information,0.3985593616962433,user account,user account
847,SQLiteDatabase_queryWithFactory,query with factory .exposes methods to manage a s q lite database,source,SQLiteDatabase,database,database,database information,0.4218290150165558,database,database
854,IsoDep_getTimeout,get timeout .provides access to iso dep  properties and input or output operations on a tag,source,IsoDep,nfc information,nfc information,file information,0.09178698062896729,nfc,files
862,AccountManager_hasFeatures,"has features .this class provides access to a centralized registry of the user's online accounts   the user enters credentials  once per account, granting applications access to online resources with ""one click"" approval",source,AccountManager,user account,user account,user information,0.285831481218338,user account,user account
863,BluetoothHeadset_getConnectedDevices,get connected devices .public api for controlling the bluetooth headset service  this includes both bluetooth headset and handsfree  profiles,source,BluetoothHeadset,bluetooth,bluetooth,bluetooth,0.40946003794670105,bluetooth,bluetooth
864,NotificationManager_notify,notify .class to notify the user of events that happen   this is how you tell the user that something has happened in the background,sink,NotificationManager,log,notification,notification,0.47162407636642456,notification,notification
871,DatagramSocket_getChannel,get channel .this class represents a socket for sending and receiving datagram packets,source,DatagramSocket,no category,network connection,network connection,0.31338173151016235,network,network
872,URLConnection_getDefaultUseCaches,"get default use caches .the abstract class url connection is the superclass of all classes that represent a communications link between the application and a url  instances of this class can be used both to read from and to write to the resource referenced by the url  in general, creating a connection to a url is a multistep process",source,URLConnection,no category,network connection,network information,0.14042438566684723,network,network
874,SQLiteDatabase_setPageSize,set page size .exposes methods to manage a s q lite database,sink,SQLiteDatabase,no category,database,database,0.42685559391975403,database,database
880,NfcF_getSystemCode,get system code .provides access to nfc f  properties and input or output operations on a tag,source,NfcF,nfc information,nfc information,nfc information,0.35765182971954346,nfc,nfc
881,LocationManager_getLastKnownLocation,"get last known location .this class provides access to the system location services  these services allow applications to obtain periodic updates of the device's geographical location, or to be notified when the device enters the proximity of a given geographical location",source,LocationManager,geolocation,geolocation,geographical location,0.2092188149690628,geolocation,geolocation
888,URLConnection_getHeaderFieldDate,"get header field date .the abstract class url connection is the superclass of all classes that represent a communications link between the application and a url  instances of this class can be used both to read from and to write to the resource referenced by the url  in general, creating a connection to a url is a multistep process",source,URLConnection,no category,network connection,media,0.1439020335674286,network,media
890,URLConnection_setRequestProperty,"set request property .the abstract class url connection is the superclass of all classes that represent a communications link between the application and a url  instances of this class can be used both to read from and to write to the resource referenced by the url  in general, creating a connection to a url is a multistep process",sink,URLConnection,no category,network connection,media,0.13460849225521088,network,media
892,DownloadManager_getMaxBytesOverMobile,"get max bytes over mobile .the download manager is a system service that handles long running http downloads  clients may request that a uri be downloaded to a particular destination file  the download manager will conduct the download in the background, taking care of http interactions and retrying downloads after failures or across connectivity changes and system reboots",source,DownloadManager,no category,network connection,network connection,0.17934226989746094,network,network
896,AccountManager_getAccountsByTypeAndFeatures,"get accounts by type and features .this class provides access to a centralized registry of the user's online accounts   the user enters credentials  once per account, granting applications access to online resources with ""one click"" approval",source,AccountManager,user account,user account,user information,0.4273020029067993,user account,user account
901,NfcAdapter_getDefaultAdapter,get default adapter .represents the local nfc adapter,source,NfcAdapter,nfc information,nfc information,nfc information,0.4771605432033539,nfc,nfc
908,AccountManager_get,"get .this class provides access to a centralized registry of the user's online accounts   the user enters credentials  once per account, granting applications access to online resources with ""one click"" approval",source,AccountManager,user account,user account,user information,0.3083201050758362,user account,user account
909,URLConnection_getContentType,"get content type .the abstract class url connection is the superclass of all classes that represent a communications link between the application and a url  instances of this class can be used both to read from and to write to the resource referenced by the url  in general, creating a connection to a url is a multistep process",source,URLConnection,no category,network connection,media,0.14129354059696198,network,media
913,AudioManager_setMicrophoneMute,set microphone mute .audio manager provides access to volume and ringer mode control,sink,AudioManager,audio,audio,audio information,0.4714268147945404,audio,audio
917,NfcA_getMaxTransceiveLength,get max transceive length .provides access to nfc a  properties and input or output operations on a tag,source,NfcA,nfc information,nfc information,nfc information,0.42351239919662476,nfc,nfc
922,AudioTrack_getPositionNotificationPeriod,"get position notification period .the audio track class manages and plays a single audio resource for java applications  it allows streaming of pcm audio buffers to the audio sink for playback  this is achieved by ""pushing"" the data to the audio track object using one of the  write, write,  and write methods",source,AudioTrack,no category,audio,audio information,0.5702614784240723,audio,audio
923,WifiP2pManager_addLocalService,"add local service .this class provides the api for managing wifi peer to peer connectivity  this lets an application discover available peers, setup connection to peers and query for the list of peers  when a p2p connection is formed over wifi, the device continues to maintain the uplink connection over mobile or any other available network for internet connectivity on the device",sink,WifiP2pManager,network connection,network connection,network connection,0.3934738337993622,network,network
926,ServerSocket_setReuseAddress,"set reuse address .this class implements server sockets  a server socket waits for requests to come in over the network  it performs some operation based on that request, and then possibly returns a result to the requester",sink,ServerSocket,no category,network connection,network connection,0.41510069370269775,network,network
927,DatagramSocket_getReuseAddress,get reuse address .this class represents a socket for sending and receiving datagram packets,source,DatagramSocket,no category,network connection,network information,0.2952573895454407,network,network
932,URLConnection_getDate,"get date .the abstract class url connection is the superclass of all classes that represent a communications link between the application and a url  instances of this class can be used both to read from and to write to the resource referenced by the url  in general, creating a connection to a url is a multistep process",source,URLConnection,no category,network connection,calendar information,0.13485431671142578,network,calendar
933,NfcAdapter_enableForegroundDispatch,enable foreground dispatch .represents the local nfc adapter,sink,NfcAdapter,nfc communication,nfc communication,nfc information,0.2936078608036041,nfc,nfc
938,URLConnection_getHeaderField,"get header field .the abstract class url connection is the superclass of all classes that represent a communications link between the application and a url  instances of this class can be used both to read from and to write to the resource referenced by the url  in general, creating a connection to a url is a multistep process",source,URLConnection,no category,network connection,media,0.15038153529167175,network,media
940,ClassLoader_loadClass,"load class .a class loader is an object that is responsible for loading classes  the class class loader is an abstract class   given the binary name of a class, a class loader should attempt to locate or generate data that constitutes a definition for the class   a typical strategy is to transform the name into a file name and then read a ""class file"" of that name from a file system",source,ClassLoader,network information,system settings,file information,0.5290166139602661,system settings,files
943,MediaRecorder_setOutputFile,set output file .used to record audio and video  the recording control is based on a simple state machine ,sink,MediaRecorder,files,files,media information,0.3850111961364746,files,media
945,DatagramSocket_getLocalPort,get local port .this class represents a socket for sending and receiving datagram packets,source,DatagramSocket,no category,network connection,network connection,0.32049182057380676,network,network
954,CalendarView_getWeekDayTextAppearance,get week day text appearance .this class is a calendar widget for displaying and selecting dates  the range of dates supported by this calendar is configurable,source,CalendarView,calendar information,calendar information,calendar information,0.8793550133705139,calendar,calendar
955,URLConnection_getRequestProperty,"get request property .the abstract class url connection is the superclass of all classes that represent a communications link between the application and a url  instances of this class can be used both to read from and to write to the resource referenced by the url  in general, creating a connection to a url is a multistep process",source,URLConnection,no category,network connection,media,0.15229786932468414,network,media
956,AudioTrack_getAudioSessionId,"get audio session id .the audio track class manages and plays a single audio resource for java applications  it allows streaming of pcm audio buffers to the audio sink for playback  this is achieved by ""pushing"" the data to the audio track object using one of the  write, write,  and write methods",source,AudioTrack,no category,audio,audio information,0.5526608228683472,audio,audio
961,SQLiteDatabase_getMaximumSize,get maximum size .exposes methods to manage a s q lite database,source,SQLiteDatabase,database,database,database,0.4358471930027008,database,database
964,WifiP2pManager_initialize,"initialize .this class provides the api for managing wifi peer to peer connectivity  this lets an application discover available peers, setup connection to peers and query for the list of peers  when a p2p connection is formed over wifi, the device continues to maintain the uplink connection over mobile or any other available network for internet connectivity on the device",source,WifiP2pManager,network information,network connection,network connection,0.45728498697280884,network,network
971,AccessibilityService_getRootInActiveWindow,"get root in active window .accessibility services should only be used to assist users with disabilities in using android devices and apps  they run in the background and receive callbacks by the system when accessibility events are fired  such events denote some state transition in the user interface, for example, the focus has changed, a button has been clicked, etc  such a service can optionally request the capability for querying the content of the active window  development of an accessibility service requires extending this class and implementing its abstract methods",source,AccessibilityService,network information,network connection,media,0.17965659499168396,network,media
972,Calendar_getAvailableLocales,"get available locales . icu's replacement for calendar  methods, fields, and other functionality specific to icu are labeled '[icu]'",source,Calendar,calendar information,calendar information,calendar information,0.3215734362602234,calendar,calendar
